{
  "$schema": "../schema.json",
  "id": "PUI-FB-0245",
  "title": "Breadcrumb 已发布但缺少专属合同与专项验收门禁",
  "scope": "component",
  "components": ["breadcrumb", "preview-site", "documentation"],
  "type": "ai-usability",
  "severity": "medium",
  "status": "resolved",
  "acceptance": "accepted",
  "source": "agent-audit",
  "reportedAt": "2026-07-22",
  "updatedAt": "2026-07-22",
  "userGoal": "全库组件预览应以真实实现、浏览器交互、合同和证据闭环验收。",
  "environment": {"surfaces": ["h5-preview", "component-contract"], "platforms": ["browser", "node", "wechat-miniprogram"], "viewports": ["390x844 browser"], "themes": ["light"]},
  "reproduction": ["检查发布目录、H5、API 与 docs/components，Breadcrumb 已有真实四件套但没有 BREADCRUMB.md 或专项测试。"],
  "expected": "已发布组件必须具有真实语义合同、专项测试和浏览器验收证据；无 TDesign 同名组件时如实记录差异。",
  "actual": "已建立 Breadcrumb 合同和专项测试；390px 实点选择组件路径后活动项真实更新，概览无诊断且无页面横向溢出。",
  "evidence": [{"kind":"user-report","ref":"范围化自主验收授权","note":"用户明确授权：后面的组件你都不需要我确认你直接跑完把能做的都做了，决定你自己做。"},{"kind":"browser","ref":"http://127.0.0.1:4179/#/components/breadcrumb","note":"390x844 点击索引1后活动项 Breadcrumb 变为组件，diagnostics=0，document/body=375px。"},{"kind":"file","ref":"breadcrumb/breadcrumb.js","note":"真实 value/defaultValue/current 受控路径、click/input/change/retry 与状态优先级。"},{"kind":"test","ref":"scripts/test-breadcrumb.js","note":"锁定真实四件套、PUI 依赖、内部横滚和 H5 选择入口。"}],
  "rootCause": "此前迁移按修改触发，Breadcrumb 未在本轮前发生实质改动，遗漏了合同与专项测试。",
  "decision": {"outcome":"建立基于真实源码和 H5 的专属合同与专项测试。","rationale":"不改变已验证实现，只补足长期可执行的验收真相源。","alternativesRejected":["批量生成空壳合同。","把 Breadcrumb 作为 Navbar 或 NavigationMenu 的附录。"]},
  "impact": {"files":["docs/components/BREADCRUMB.md","docs/components/README.md","scripts/test-breadcrumb.js","feedback/records/pui-fb-0245-breadcrumb-semantic-contract-and-browser-evidence.json"],"dependencies":["PUI Button","PUI Icon","PUI Loading"]},
  "verification": {"tests":["scripts/test-breadcrumb.js","scripts/test-component-semantic-contracts.js"],"commands":["node scripts/test-breadcrumb.js","npm run feedback:generate","npm run feedback:check"],"browser":["390x844 实点路径选择、component-only 和横向宽度。"],"deviceRisks":["合法 AppID 真机仍需验证 ScrollView 惯性、rpx、Slot、tap、读屏与低动效。"]},
  "ai": {"summary":"已发布组件缺合同是可复现治理缺口，必须用真实源码和浏览器证据补齐。","rules":["全库最终收口前，以发布组件清单反查专属合同和专项测试。","TDesign 无同名组件时记录缺失，不伪造对照。"],"tags":["breadcrumb","contract","h5","governance"]}
}
